<?xml version="1.0"?>
<races BBversion="5" xmlns:xsi="http://www.w3.org/2001/XMLSchema-instance" xsi:noNamespaceSchemaLocation="races.xsd">
	<race name="Amazon" emblem="amazon.jpg">
		<apothecary use="true"/>
		<reroll cost="50000" qty="8"/>
		<positions>
			<position qty="16" title="Linewomam" cost="50000" ma="6" st="3" ag="3" av="7" normal="g" double="asp">
				<skills>
					<skill name="dodge"/>
				</skills>
			</position>
			<position qty="2" title="Thrower" cost="70000" ma="6" st="3" ag="3" av="7" normal="gp" double="as">
				<skills>
					<skill name="dodge"/>
					<skill name="pass"/>
				</skills>
			</position>
			<position qty="2" title="Catcher" cost="70000" ma="6" st="3" ag="3" av="7" normal="ga" double="sp">
				<skills>
					<skill name="dodge"/>
					<skill name="catch"/>
				</skills>
			</position>
			<position qty="4" title="Blitzer" cost="90000" ma="6" st="3" ag="3" av="7" normal="gs" double="ap">
				<skills>
					<skill name="dodge"/>
					<skill name="block"/>
				</skills>
			</position>
		</positions>
		<background>Long ago, driven by a desire for adventure, the Valkyries of the Norse settlement in Lustria sailed away from their men-folk and founded a colony deep within the estuary of the river Amaxon. Now these ferocious warriors have taken to the Blood Bowl pitch and Nuffle save those who dare play against them!</background>
	</race>
	<race name="Chaos" emblem="chaos.jpg">
		<apothecary use="true"/>
		<reroll cost="60000" qty="8"/>
		<positions>
			<position qty="16" title="Beastman" cost="60000" ma="6" st="3" ag="3" av="8" normal="gsm" double="ap">
				<skills>
					<skill name="horns"/>
				</skills>
			</position>
			<position qty="4" title="Chaos warrior" cost="100000" ma="5" st="4" ag="3" av="9" normal="gsm" double="ap">
				<skills/>
			</position>
			<position qty="1" title="Minotaur" cost="150000" ma="5" st="5" ag="2" av="8" normal="sm" double="gap">
				<skills>
					<skill name="loner"/>
					<skill name="frenzy"/>
					<skill name="horns"/>
					<skill name="mighty blow"/>
					<skill name="thick skull"/>
					<skill name="wild animal"/>
				</skills>
			</position>
		</positions>
		<background>Chaos teams are not noted for the subtlety or originality of their game play. A simple drive up the centre of the pitch, maiming and injuring as many opposing players as possible, is about the limit of their game plan. They rarely, if ever, worry about such minor considerations like picking up the ball and scoring touchdowns not while there are any players left alive on the opposing team, anyway.</background>
	</race>
	<race name="Chaos Dwarf" emblem="chaosdwarves.jpg">
		<apothecary use="true"/>
		<reroll cost="70000" qty="8"/>
		<positions>
			<position qty="16" title="Hobgoblin" cost="40000" ma="6" st="3" ag="3" av="7" normal="g" double="asp">
				<skills/>
			</position>
			<position qty="6" title="Chaos dwarf" cost="70000" ma="4" st="3" ag="2" av="9" normal="gs" double="apm">
				<skills>
					<skill name="block"/>
					<skill name="tackle"/>
					<skill name="thick skull"/>
				</skills>
			</position>
			<position qty="2" title="Bull centaurs" cost="130000" ma="6" st="4" ag="2" av="9" normal="gs" double="ap">
				<skills>
					<skill name="sprint"/>
					<skill name="sure feet"/>
					<skill name="thick skull"/>
				</skills>
			</position>
			<position qty="1" title="Minotaur" cost="150000" ma="5" st="5" ag="2" av="8" normal="s" double="gapm">
				<skills>
					<skill name="loner"/>
					<skill name="frenzy"/>
					<skill name="horns"/>
					<skill name="mighty blow"/>
					<skill name="thick skull"/>
					<skill name="wild animal"/>
				</skills>
			</position>
		</positions>
		<background>Chaos Dwarfs are the twisted descendants of Dwarf explorers who have been terribly affected by the forces of Chaos, turning them into evil, self-centred creatures. In one way, however, they haven't changed at all, they still love playing Blood Bowl! Chaos Dwarfs are not very numerous and make great use of sneaky Hobgoblin slaves to perform all kinds of tasks, including playing on their Blood Bowl teams.</background>
	</race>
	<race name="Dark Elf" emblem="darkelves.jpg">
		<apothecary use="true"/>
		<reroll cost="50000" qty="8"/>
		<positions>
			<position qty="16" title="Lineman" cost="70000" ma="6" st="3" ag="4" av="8" normal="ga" double="sp">
				<skills/>
			</position>
			<position qty="2" title="Runner" cost="80000" ma="7" st="3" ag="4" av="7" normal="gap" double="s">
				<skills>
					<skill name="dump off"/>
				</skills>
			</position>
			<position qty="2" title="Assassin" cost="90000" ma="6" st="3" ag="4" av="7" normal="ga" double="sp">
				<skills>
					<skill name="shadowing"/>
					<skill name="stab"/>
				</skills>
			</position>
			<position qty="4" title="Blitzer" cost="100000" ma="7" st="3" ag="4" av="8" normal="ga" double="sp">
				<skills>
					<skill name="block"/>
				</skills>
			</position>
			<position qty="2" title="Witch elf" cost="110000" ma="7" st="3" ag="4" av="7" normal="ga" double="sp">
				<skills>
					<skill name="frenzy"/>
					<skill name="dodge"/>
					<skill name="jump up"/>
				</skills>
			</position>
		</positions>
		<background>Evil beyond belief, skilled without doubt, the Dark Elves take to the pitch to show the world their superiority. Dark Elf teams prefer a malevolent and spiteful running game over the passing of their goodly cousins. Backed up by the ruthless Witch Elves and dangerous assassins, a Dark Elf team has all the tools to power through rather than around any opposition line.</background>
	</race>
	<race name="Dwarf" emblem="dwarves.jpg">
		<apothecary use="true"/>
		<reroll cost="40000" qty="8"/>
		<positions>
			<position qty="16" title="Blocker" cost="70000" ma="4" st="3" ag="2" av="9" normal="gs" double="ap">
				<skills>
					<skill name="block"/>
					<skill name="tackle"/>
					<skill name="thick skull"/>
				</skills>
			</position>
			<position qty="2" title="Runner" cost="80000" ma="6" st="3" ag="3" av="8" normal="gp" double="as">
				<skills>
					<skill name="sure hands"/>
					<skill name="thick skull"/>
				</skills>
			</position>
			<position qty="2" title="Blitzer" cost="80000" ma="5" st="3" ag="3" av="9" normal="gs" double="ap">
				<skills>
					<skill name="block"/>
					<skill name="thick skull"/>
				</skills>
			</position>
			<position qty="2" title="Troll slayer" cost="90000" ma="5" st="3" ag="2" av="8" normal="gs" double="ap">
				<skills>
					<skill name="block"/>
					<skill name="dauntless"/>
					<skill name="frenzy"/>
					<skill name="thick skull"/>
				</skills>
			</position>
			<position qty="1" title="Deathroller" cost="160000" ma="4" st="7" ag="1" av="10" normal="s" double="gap">
				<skills>
					<skill name="break tackle"/>
					<skill name="dirty player"/>
					<skill name="juggernaut"/>
					<skill name="mighty blow"/>
					<skill name="no hands"/>
					<skill name="secret weapon"/>
					<skill name="stand firm"/>
				</skills>
			</position>
		</positions>
		<background>Dwarfs seem to be ideal Blood Bowl players, being compact, tough, well-armoured and having a stubborn knack of refusing to die! Most successful Dwarf teams work to the principle that if they can take out all the other team's potential scorers, and wear down the rest, then there won't be anybody left to stop them scoring the winning touchdowns!</background>
	</race>
	<race name="Elf" emblem="elves.jpg">
		<apothecary use="true"/>
		<reroll cost="50000" qty="8"/>
		<positions>
			<position qty="16" title="Lineman" cost="60000" ma="6" st="3" ag="4" av="7" normal="ga" double="sp">
				<skills/>
			</position>
			<position qty="2" title="Thrower" cost="70000" ma="6" st="3" ag="4" av="7" normal="gap" double="s">
				<skills>
					<skill name="pass"/>
				</skills>
			</position>
			<position qty="4" title="Catcher" cost="100000" ma="8" st="3" ag="4" av="7" normal="ga" double="sp">
				<skills>
					<skill name="catch"/>
					<skill name="nerves of steel"/>
				</skills>
			</position>
			<position qty="2" title="Blitzer" cost="110000" ma="7" st="3" ag="4" av="8" normal="ga" double="sp">
				<skills>
					<skill name="block"/>
					<skill name="side step"/>
				</skills>
			</position>
		</positions>
		<background>When the NAF collapsed, many Elven teams were left penniless. Those teams that have survived the fallout are not as rich as the High Elf teams nor as well equipped, but they sure know how to play the game. Sporting facemasks and mohawks, they take to the pitch to relive the glory days they once played in.</background>
	</race>
	<race name="Goblin" emblem="goblins.jpg">
		<apothecary use="true"/>
		<reroll cost="60000" qty="8"/>
		<positions>
			<position qty="16" title="Goblin" cost="40000" ma="6" st="2" ag="3" av="7" normal="a" double="gsp">
				<skills>
					<skill name="dodge"/>
					<skill name="right stuff"/>
					<skill name="stunty"/>
				</skills>
			</position>
			<position qty="1" title="Bombardier" cost="40000" ma="6" st="2" ag="3" av="7" normal="a" double="gsp">
				<skills>
					<skill name="bombardier"/>
					<skill name="dodge"/>
					<skill name="no hands"/>
					<skill name="secret weapon"/>
					<skill name="stunty"/>
				</skills>
			</position>
			<position qty="1" title="Pogoer" cost="40000" ma="7" st="2" ag="3" av="7" normal="a" double="gsp">
				<skills>
					<skill name="dirty player"/>
					<skill name="dodge"/>
					<skill name="leap"/>
					<skill name="secret weapon"/>
					<skill name="stunty"/>
					<skill name="very long legs"/>
				</skills>
			</position>
			<position qty="1" title="Looney" cost="40000" ma="6" st="2" ag="3" av="7" normal="a" double="gsp">
				<skills>
					<skill name="chainsaw"/>
					<skill name="no hands"/>
					<skill name="secret weapon"/>